{
  "$schema": "https://json-schema.org/draft/2020-12/schema",
  "$id": "https://kratos.dev/schemas/state/project-config/v1.1",
  "title": "Kratos project configuration v1.1",
  "type": "object",
  "additionalProperties": false,
  "required": [
    "contractVersion",
    "stateContract",
    "pluginVersion",
    "hostContract",
    "language",
    "policyMode",
    "managedState",
    "modelRoles"
  ],
  "properties": {
    "contractVersion": { "const": "1.1.0" },
    "stateContract": { "const": "1.1.0" },
    "pluginVersion": { "$ref": "#/$defs/pluginVersion" },
    "hostContract": { "const": "1.1.0" },
    "language": { "enum": ["en", "pt-BR"] },
    "policyMode": { "enum": ["standard", "strict"] },
    "managedState": {
      "type": "object",
      "additionalProperties": false,
      "required": ["directory", "eventLog", "snapshots"],
      "properties": {
        "directory": { "const": ".brain" },
        "eventLog": { "const": "events.jsonl" },
        "snapshots": { "type": "boolean" }
      }
    },
    "modelRoles": { "$ref": "#/$defs/modelRoles" }
  },
  "$defs": {
    "pluginVersion": {
      "type": "string",
      "pattern": "^(0|[1-9]\\d*)\\.(0|[1-9]\\d*)\\.(0|[1-9]\\d*)(?:-[0-9A-Za-z-]+(?:\\.[0-9A-Za-z-]+)*)?(?:\\+[0-9A-Za-z-]+(?:\\.[0-9A-Za-z-]+)*)?$"
    },
    "id": {
      "type": "string",
      "pattern": "^[a-zA-Z0-9][a-zA-Z0-9._:-]{0,127}$"
    },
    "assignment": {
      "oneOf": [
        { "$ref": "#/$defs/id" },
        {
          "type": "object",
          "additionalProperties": false,
          "required": ["model", "effort"],
          "properties": {
            "model": { "$ref": "#/$defs/id" },
            "effort": { "$ref": "#/$defs/id" }
          }
        }
      ]
    },
    "roleMap": {
      "type": "object",
      "additionalProperties": false,
      "properties": {
        "planner": { "$ref": "#/$defs/assignment" },
        "implementer": { "$ref": "#/$defs/assignment" },
        "judge": { "$ref": "#/$defs/assignment" }
      }
    },
    "modelRoles": {
      "type": "object",
      "additionalProperties": false,
      "minProperties": 1,
      "properties": {
        "claude": { "$ref": "#/$defs/roleMap" },
        "codex": { "$ref": "#/$defs/roleMap" }
      }
    }
  }
}
